{
  "name": {
    "en": "Junior kyu grades (USJF)"
  },
  "organisation": "United States Judo Federation",
  "country": "US",
  "order": 8,
  "description": {
    "en": "The United States Judo Federation's recommended junior pathway for judoka aged 16 and under: eleven kyu grades from white to purple belt, then Shodan. Each grade covers personal development, vocabulary, history, rules and technique, with shime waza and kansetsu waza added at the older ages."
  },
  "source": {
    "title": "USJF Rank Requirements, Junior (chart)",
    "date": "22 September 2023",
    "note": {
      "en": "The federation's junior pathway is set out in two documents: the junior section of the Rank Requirement Recommendations Handbook (5/1/21) and the newer junior rank requirements chart (9/22/23). Both describe the same eleven kyu grades and Shodan with the same belt colours, so they are one scheme, and the 2023 chart is transcribed as the current requirements. The chart is a grid of rows (personal development, general concepts, vocabulary, history, rules, tachi waza, osae waza, shime waza, kansetsu waza, kata) by rank; each non-empty cell becomes a section, each printed bullet an item, and an indented sub-list is joined to its heading after a colon, separated by commas. Cell headings are kept at the start of the item they introduce, or as an item of their own where a bulleted list follows. The line printed once above the tachi waza row, \"Judoka must be able to name, demonstrate and define each techique\", is repeated at the head of each grade's tachi waza section. Three cells in the Yonkyu column are cut off at the cell edge in the chart and are transcribed as far as they print (\"Expand physical fitness and\", \"Continued dojo level refere\", \"Continue to expand osae wa\"). The chart prints \"Age Appropriate if over 12\" and \"Age Appropriate for 14 and up\" in the Gokyu column only, although its shime waza and kansetsu waza content begins at Adv Sankyu. The chart gives no minimum ages or class counts, so those are kept from the handbook's junior section, in a section labelled as coming from it. The two documents differ throughout: the handbook's junior section allocates the techniques differently (for example O soto-gari, Deashi-barai and Ippon Seoi-nage at Jukyu, where the chart has o goshi and uki goshi), sets shime waza from 13 and kansetsu waza from 17 where the chart says 12 and 14, spells the 7th grade \"Nankyu\" where the ranking table has Nanakyu, and repeats the senior Shodan requirements for junior Shodan. Item text is as printed, including the chart's slips (\"compeition\", \"transitinal\", \"techique\", \"Enchanced\", \"philisophy\", \"cother\", \"hikkomi gaeshi\", resolved to Hikikomi-gaeshi). The chart names grades by the Mon system (Rokkyu, Advanced Rokkyu and so on); labels here give the handbook's rank name with the Mon name in brackets. The handbook's ranking table also lists a Traditional Junior column (White, Yellow, Orange, Green, Blue, Purple for Rokkyu to Ikkyu) with no requirements of its own, so it is not a separate scheme here. \"morote-jime\", \"sankaku gatame\" under osae waza and \"mawari ashi\" are left unresolved."
    }
  },
  "beltMark": "stripe",
  "beltNote": {
    "en": "The handbook prints each in-between grade as a two-colour belt, for example White/Yellow, or under the Mon system as the lower colour with a stripe of the higher; either is allowed."
  },
  "grades": [
    {
      "slug": "11th-kyu",
      "label": {
        "en": "Juichikyu (Rokkyu)"
      },
      "beltColor": "white",
      "techniqueSlugs": [],
      "syllabus": [
        {
          "slug": "personal-development",
          "title": {
            "en": "Personal development (moral character)"
          },
          "items": [
            {
              "text": "What is a good judoka?",
              "techniques": []
            },
            {
              "text": "How to be a good judoka?",
              "techniques": []
            },
            {
              "text": "Judo virtues include:",
              "techniques": []
            },
            {
              "text": "Knowledge: academic achievement, perseverance, courage, growth",
              "techniques": []
            },
            {
              "text": "Self-control: obedience, humility, honor, compassion",
              "techniques": []
            },
            {
              "text": "Integrity: honesty, courtesy, respect, sincerity, loyalty",
              "techniques": []
            }
          ]
        },
        {
          "slug": "general-concepts",
          "title": {
            "en": "General concepts (physical demonstration)"
          },
          "items": [
            {
              "text": "To learn and demonstrate that each judoka's main responsibility in club/class is to keep everyone you work/play with safe and to help everyone learn.",
              "techniques": []
            },
            {
              "text": "To tie my own obi.",
              "techniques": [],
              "terms": [
                "obi"
              ]
            },
            {
              "text": "Ability to perform Ushiro Ukemi from a sitting, squatting, and standing position",
              "techniques": [],
              "skills": [
                "ushiro-ukemi"
              ]
            },
            {
              "text": "Ability to perform Yoko Ukemi from a sitting and squatting position",
              "techniques": [],
              "skills": [
                "yoko-ukemi"
              ]
            },
            {
              "text": "Ability to perform Zenpo Kaiten from a kneeling position",
              "techniques": [],
              "skills": [
                "mae-mawari-ukemi"
              ]
            }
          ]
        },
        {
          "slug": "vocabulary",
          "title": {
            "en": "Vocabulary and essential questions"
          },
          "items": [
            {
              "text": "What is a gi?",
              "techniques": [],
              "terms": [
                "judogi"
              ]
            },
            {
              "text": "EQ: Why do we wear a uniform?",
              "techniques": []
            }
          ]
        },
        {
          "slug": "history-and-philosophy",
          "title": {
            "en": "History and philosophy"
          },
          "items": [
            {
              "text": "Why we learn judo.",
              "techniques": []
            },
            {
              "text": "What judo is and is not.",
              "techniques": []
            }
          ]
        },
        {
          "slug": "rules",
          "title": {
            "en": "Rules"
          },
          "items": [
            {
              "text": "Specific rules of the dojo/class.",
              "techniques": []
            },
            {
              "text": "Basic expectations and guided protocols",
              "techniques": []
            }
          ]
        },
        {
          "slug": "tachi-waza",
          "title": {
            "en": "Tachi waza"
          },
          "items": [
            {
              "text": "Judoka must be able to name, demonstrate and define each techique, developing both sides",
              "techniques": []
            },
            {
              "text": "Uke kneels, Tori stands",
              "techniques": []
            }
          ]
        },
        {
          "slug": "osae-waza",
          "title": {
            "en": "Osae waza"
          },
          "items": [
            {
              "text": "Concept of what constitutes a successful gatame",
              "techniques": []
            }
          ]
        },
        {
          "slug": "section-vii-age-and-classes",
          "title": {
            "en": "Minimum age and classes (Section VII, 2021)"
          },
          "items": [
            {
              "text": "Min age 4-5 years old",
              "techniques": []
            }
          ]
        }
      ],
      "links": [
        {
          "title": "Junior Rank Requirements Matrix (9/22/23)",
          "url": "https://www.usjf.com/wp-content/uploads/2023/10/USJF-Rank-Requirements-Horizontal-Jr.-9_22_23.pdf",
          "source": "United States Judo Federation"
        },
        {
          "title": "Junior Rank Recommendations, Handbook Section VII (5/1/21)",
          "url": "https://www.usjf.com/wp-content/uploads/2021/05/Handbook-Final-Revised-Jr-5-1-21.pdf",
          "source": "United States Judo Federation"
        }
      ]
    },
    {
      "slug": "10th-kyu",
      "label": {
        "en": "Jukyu (Adv. Rokkyu)"
      },
      "beltColor": "white",
      "beltStripe": "yellow",
      "techniqueSlugs": [
        "o-goshi",
        "uki-goshi",
        "kesa-gatame",
        "yoko-shiho-gatame"
      ],
      "syllabus": [
        {
          "slug": "personal-development",
          "title": {
            "en": "Personal development (moral character)"
          },
          "items": [
            {
              "text": "Etiquette (reigi saho)",
              "techniques": []
            },
            {
              "text": "Expand understanding of virtues of judo",
              "techniques": []
            },
            {
              "text": "Expand physical fitness and adeptness",
              "techniques": []
            },
            {
              "text": "Maturing/developing character traits",
              "techniques": []
            },
            {
              "text": "Academic achievement",
              "techniques": []
            },
            {
              "text": "To be an active learner",
              "techniques": []
            },
            {
              "text": "To be an active participant",
              "techniques": []
            },
            {
              "text": "Family engagement",
              "techniques": []